time,source_ip,dest_ip,protocol,len,info,source_port,dest_port
2021-04-13 16:35:50,10.177.224.142,60.167.130.134,HTTPS,54,Ether / IP / TCP 10.177.224.142:50565 > 60.167.130.134:https A,50565,443
2021-04-13 16:35:50,60.167.130.134,10.177.224.142,HTTPS,1502,Ether / IP / TCP 60.167.130.134:https > 10.177.224.142:50562 A / Raw,443,50562
2021-04-13 16:35:50,60.167.130.134,10.177.224.142,HTTPS,1502,Ether / IP / TCP 60.167.130.134:https > 10.177.224.142:50565 A / Raw,443,50565
2021-04-13 16:35:50,60.167.130.134,10.177.224.142,HTTPS,1502,Ether / IP / TCP 60.167.130.134:https > 10.177.224.142:50566 A / Raw,443,50566
2021-04-13 16:35:50,10.177.224.142,60.167.130.134,HTTPS,66,Ether / IP / TCP 10.177.224.142:50565 > 60.167.130.134:https A,50565,443
